{
  "schemaVersion": 1,
  "title": "周易經傳結構化資料",
  "language": "zh-Hant",
  "source": {
    "project": "中文維基文庫",
    "title": "周易",
    "url": "https://zh.wikisource.org/wiki/周易",
    "revisionId": null,
    "retrievedAt": "2026-06-27T16:03:20.692Z",
    "captureMethod": "mcp_router_browser_bridge"
  },
  "stats": {
    "hexagramCount": 64,
    "regularLineCount": 384,
    "specialLineCount": 2,
    "tenWingPartCount": 10
  },
  "hexagrams": [
    {
      "number": 1,
      "name": "乾",
      "aliases": [
        "乾"
      ],
      "glyph": "䷀",
      "canonSection": "upper",
      "composition": {
        "lowerTrigram": "乾",
        "upperTrigram": "乾",
        "text": "乾下乾上"
      },
      "classic": {
        "judgment": {
          "paragraphs": [
            "乾：元亨。利貞。"
          ],
          "text": "乾：元亨。利貞。"
        },
        "lines": [
          {
            "position": 1,
            "label": "初九",
            "text": "潛龍勿用。"
          },
          {
            "position": 2,
            "label": "九二",
            "text": "見龍在田，利見大人。"
          },
          {
            "position": 3,
            "label": "九三",
            "text": "君子終日乾乾，夕惕若；厲，无咎。"
          },
          {
            "position": 4,
            "label": "九四",
            "text": "或躍在淵，无咎。"
          },
          {
            "position": 5,
            "label": "九五",
            "text": "飛龍在天，利見大人。"
          },
          {
            "position": 6,
            "label": "上九",
            "text": "亢龍，有悔。"
          }
        ],
        "specialLine": {
          "label": "用九",
          "text": "見羣龍無首，吉。"
        }
      },
      "wings": {
        "tuan": {
          "paragraphs": [
            "大哉乾元，萬物資始，乃統天。雲行雨施，品物流形，大明終始，六位時成。",
            "時乘六龍以御天，乾道變化，各正性命，保合大和〈一作太和〉，乃利貞。",
            "首出庶物，萬國咸寧。"
          ],
          "text": "大哉乾元，萬物資始，乃統天。雲行雨施，品物流形，大明終始，六位時成。\n時乘六龍以御天，乾道變化，各正性命，保合大和〈一作太和〉，乃利貞。\n首出庶物，萬國咸寧。"
        },
        "xiang": {
          "greatImage": "天行健，君子以自強不息。",
          "lineImages": [
            {
              "position": 1,
              "forLabel": "初九",
              "text": "潛龍勿用，陽在下也。"
            },
            {
              "position": 2,
              "forLabel": "九二",
              "text": "見龍在田，德施普也。"
            },
            {
              "position": 3,
              "forLabel": "九三",
              "text": "終日乾乾，反復道也。"
            },
            {
              "position": 4,
              "forLabel": "九四",
              "text": "或躍在淵，進無咎也。"
            },
            {
              "position": 5,
              "forLabel": "九五",
              "text": "飛龍在天，大人造也。"
            },
            {
              "position": 6,
              "forLabel": "上九",
              "text": "亢龍有悔，盈不可久也。"
            },
            {
              "position": null,
              "forLabel": "用九",
              "text": "用九，天德不可為首也。"
            }
          ]
        },
        "wenyan": {
          "groups": [
            {
              "entries": [
                {
                  "kind": "paragraph",
                  "text": "元者，善之長也。亨者，嘉之會也。利者，義之和也。貞者，事之幹也。君子體仁足以長人，嘉會足以合禮，利物足以和義，貞固足以幹事。君子行此四德者，故曰：「乾，元、亨、利、貞。」"
                },
                {
                  "kind": "paragraph",
                  "text": "初九曰：「潛龍，勿用。」何謂也？子曰：「龍德而隱者也。不易乎世，不成乎名，遯世無悶，不見是而無悶，樂則行之，憂則違之，確乎其不可拔，潛龍也。」"
                },
                {
                  "kind": "paragraph",
                  "text": "九二曰：「見龍在田，利見大人。」何謂也？子曰：「龍德而正中者也。庸言之信，庸行之謹；閑邪存其誠，善世而不伐，德博而化。易曰：『見龍在田，利見大人。』君德也。」"
                },
                {
                  "kind": "paragraph",
                  "text": "九三曰：「君子終日乾乾，夕惕若，厲，无咎。」何謂也？子曰：「君子進德脩業。忠信，所以進德也；脩辭立其誠，所以居業也。知至至之，可與言幾也。知終終之，可與存義也。是故居上位而不驕，在下位而不憂，故乾乾因其時而惕，雖危无咎矣。」"
                },
                {
                  "kind": "paragraph",
                  "text": "九四曰：「或躍在淵，无咎。」何謂也？子曰：「上下無常，非為邪也。進退無恆，非離羣也。君子進德脩業，欲及時也。故无咎。」"
                },
                {
                  "kind": "paragraph",
                  "text": "九五曰：「飛龍在天，利見大人。」何謂也？子曰：「同聲相應，同氣相求；水流濕，火就燥，雲從龍，風從虎；聖人作而萬物覩；本乎天者親上，本乎地者親下，則各從其類也。」"
                },
                {
                  "kind": "paragraph",
                  "text": "上九曰：「亢龍，有悔。」何謂也？子曰：「貴而無位，高而無民，賢人在下位而無輔，是以動而有悔也。」"
                },
                {
                  "kind": "paragraph",
                  "text": "「潛龍勿用」，下也。"
                },
                {
                  "kind": "paragraph",
                  "text": "「見龍在田」，時舍也。"
                },
                {
                  "kind": "paragraph",
                  "text": "「終日乾乾」，行事也。"
                },
                {
                  "kind": "paragraph",
                  "text": "「或躍在淵」，自試也。"
                },
                {
                  "kind": "paragraph",
                  "text": "「飛龍在天」，上治也。"
                },
                {
                  "kind": "paragraph",
                  "text": "「亢龍有悔」，窮之災也。"
                },
                {
                  "kind": "paragraph",
                  "text": "「乾元用九」，天下治也。"
                },
                {
                  "kind": "paragraph",
                  "text": "「潛龍勿用」，陽氣潛藏。"
                },
                {
                  "kind": "paragraph",
                  "text": "「見龍在田」，天下文明。"
                },
                {
                  "kind": "paragraph",
                  "text": "「終日乾乾」，與時偕行。"
                },
                {
                  "kind": "paragraph",
                  "text": "「或躍在淵」，乾道乃革。"
                },
                {
                  "kind": "paragraph",
                  "text": "「飛龍在天」，乃位乎天德。"
                },
                {
                  "kind": "paragraph",
                  "text": "「亢龍有悔」，與時偕極。"
                },
                {
                  "kind": "paragraph",
                  "text": "「乾元用九」，乃見天則。"
                },
                {
                  "kind": "paragraph",
                  "text": "乾元者，始而亨者也。利貞者，性情也。乾始能以美利利天下，不言所利，大矣哉！大哉乾元，剛健中正，純粹精也。六爻發揮，旁通情也。時乘六龍，以御天也。雲行雨施，天下平也。"
                },
                {
                  "kind": "paragraph",
                  "text": "君子以成德為行，日可見之行也。潛之為言也，隱而未見，行而未成，是以君子弗用也。"
                },
                {
                  "kind": "paragraph",
                  "text": "君子學以聚之，問以辯之，寬以居之，仁以行之，易曰：「見龍在田，利見大人。」君德也。"
                },
                {
                  "kind": "paragraph",
                  "text": "九三，重剛而不中，上不在天，下不在田；故乾乾因其時而惕，雖危，无咎矣。"
                },
                {
                  "kind": "paragraph",
                  "text": "九四，重剛而不中，上不在天，下不在田，中不在人，故或之。或之者，疑之也，故无咎。"
                },
                {
                  "kind": "paragraph",
                  "text": "夫大人者，與天地合其德，與日月合其明，與四時合其序，與鬼神合其吉凶；先天而天弗違，後天而奉天時，天且弗違，而況於人乎？況於鬼神乎？"
                },
                {
                  "kind": "paragraph",
                  "text": "亢之為言也，知進而不知退，知存而不知亡，知得而不知喪；其唯聖人乎？知進退存亡而不失其正者，其唯聖人乎！"
                }
              ]
            }
          ],
          "text": "元者，善之長也。亨者，嘉之會也。利者，義之和也。貞者，事之幹也。君子體仁足以長人，嘉會足以合禮，利物足以和義，貞固足以幹事。君子行此四德者，故曰：「乾，元、亨、利、貞。」\n初九曰：「潛龍，勿用。」何謂也？子曰：「龍德而隱者也。不易乎世，不成乎名，遯世無悶，不見是而無悶，樂則行之，憂則違之，確乎其不可拔，潛龍也。」\n九二曰：「見龍在田，利見大人。」何謂也？子曰：「龍德而正中者也。庸言之信，庸行之謹；閑邪存其誠，善世而不伐，德博而化。易曰：『見龍在田，利見大人。』君德也。」\n九三曰：「君子終日乾乾，夕惕若，厲，无咎。」何謂也？子曰：「君子進德脩業。忠信，所以進德也；脩辭立其誠，所以居業也。知至至之，可與言幾也。知終終之，可與存義也。是故居上位而不驕，在下位而不憂，故乾乾因其時而惕，雖危无咎矣。」\n九四曰：「或躍在淵，无咎。」何謂也？子曰：「上下無常，非為邪也。進退無恆，非離羣也。君子進德脩業，欲及時也。故无咎。」\n九五曰：「飛龍在天，利見大人。」何謂也？子曰：「同聲相應，同氣相求；水流濕，火就燥，雲從龍，風從虎；聖人作而萬物覩；本乎天者親上，本乎地者親下，則各從其類也。」\n上九曰：「亢龍，有悔。」何謂也？子曰：「貴而無位，高而無民，賢人在下位而無輔，是以動而有悔也。」\n「潛龍勿用」，下也。\n「見龍在田」，時舍也。\n「終日乾乾」，行事也。\n「或躍在淵」，自試也。\n「飛龍在天」，上治也。\n「亢龍有悔」，窮之災也。\n「乾元用九」，天下治也。\n「潛龍勿用」，陽氣潛藏。\n「見龍在田」，天下文明。\n「終日乾乾」，與時偕行。\n「或躍在淵」，乾道乃革。\n「飛龍在天」，乃位乎天德。\n「亢龍有悔」，與時偕極。\n「乾元用九」，乃見天則。\n乾元者，始而亨者也。利貞者，性情也。乾始能以美利利天下，不言所利，大矣哉！大哉乾元，剛健中正，純粹精也。六爻發揮，旁通情也。時乘六龍，以御天也。雲行雨施，天下平也。\n君子以成德為行，日可見之行也。潛之為言也，隱而未見，行而未成，是以君子弗用也。\n君子學以聚之，問以辯之，寬以居之，仁以行之，易曰：「見龍在田，利見大人。」君德也。\n九三，重剛而不中，上不在天，下不在田；故乾乾因其時而惕，雖危，无咎矣。\n九四，重剛而不中，上不在天，下不在田，中不在人，故或之。或之者，疑之也，故无咎。\n夫大人者，與天地合其德，與日月合其明，與四時合其序，與鬼神合其吉凶；先天而天弗違，後天而奉天時，天且弗違，而況於人乎？況於鬼神乎？\n亢之為言也，知進而不知退，知存而不知亡，知得而不知喪；其唯聖人乎？知進退存亡而不失其正者，其唯聖人乎！"
        }
      },
      "source": {
        "title": "周易/乾 - 維基文庫，自由的圖書館",
        "url": "https://zh.wikisource.org/zh-hant/%E5%91%A8%E6%98%93/%E4%B9%BE",
        "revisionId": null,
        "captureMethod": "mcp_router_browser_bridge"
      }
    },
    {
      "number": 2,
      "name": "坤",
      "aliases": [
        "坤"
      ],
      "glyph": "䷁",
      "canonSection": "upper",
      "composition": {
        "lowerTrigram": "坤",
        "upperTrigram": "坤",
        "text": "坤下坤上"
      },
      "classic": {
        "judgment": {
          "paragraphs": [
            "坤：元亨。利牝馬之貞。",
            "君子有攸往，先迷後得主。",
            "利西南得朋，東北喪朋。安貞，吉。"
          ],
          "text": "坤：元亨。利牝馬之貞。\n君子有攸往，先迷後得主。\n利西南得朋，東北喪朋。安貞，吉。"
        },
        "lines": [
          {
            "position": 1,
            "label": "初六",
            "text": "履霜，堅冰至。"
          },
          {
            "position": 2,
            "label": "六二",
            "text": "直方大，不習无不利。"
          },
          {
            "position": 3,
            "label": "六三",
            "text": "含章，可貞。或從王事，无成有終。"
          },
          {
            "position": 4,
            "label": "六四",
            "text": "括囊，无咎无譽。"
          },
          {
            "position": 5,
            "label": "六五",
            "text": "黃裳，元吉。"
          },
          {
            "position": 6,
            "label": "上六",
            "text": "龍戰于野，其血玄黃。"
          }
        ],
        "specialLine": {
          "label": "用六",
          "text": "利永貞。"
        }
      },
      "wings": {
        "tuan": {
          "paragraphs": [
            "至哉坤元，萬物資生，乃順承天。坤厚載物，德合无疆；含弘光大，品物咸亨。牝馬地類，行地无疆，柔順利貞。",
            "君子攸行，先迷失道，後順得常。",
            "西南得朋，乃與類行，東北喪朋，乃終有慶。安貞之吉，應地无疆。"
          ],